rule	lat	eng
357	Quō quis versūtior, eō suspectior.	The more shrewd any one is, the more is he suspected.
358	Haec aiō, nec quisquam negat.	This I say, and no one denies it.
358	Negant sē cuiusquam imperiō esse obtemperātūrōs.	They refuse to obey any one’s command.
358	Et est quisquam?	And is there any one?
358	Vetat lēx ūllam rem esse cuiusquam quī lēgibus pārēre nōlit.	The law forbids that anything should belong to any one who refuses to obey the laws.
358	Fortior erat quam amīcōrum quisquam.	He was braver than any of his friends.
358	Sōlis candor illūstrior est quam ūllīus ignis.	The brightness of the sun is more intense than that of any fire.
359	Quodlibet prō patriā, parentibus, amīcīs adīre perīculum oportet.	We ought to encounter any danger for our country, our parents, and our friends.
359	Mihi quidvīs satis est.	Anything is enough for me.
360	Dīxerit aliquis.	Someone will say.
360	Senēs quibus aliquid rōboris supererat.	Old men who had still some strength remaining.
360	Dīcet quispiam.	Someone will say.
360	Sunt quī dīcant.	Some say.
360	Erant quī dīcerent.	Some said.
360	Disertōs cognōvī nōnnūllōs, ēloquentem nēminem.	I have met with several clever speakers, but not a single man of eloquence.
361	Quīdam ex plēbe ōrātiōnem habuit.	A man of the commons made a speech.
361	Quōdam tempore.	At a certain time.
361	Cīvis quīdam Rōmānus.	A certain citizen of Rome.
361	Erat in eō virō dīvīna quaedam ingeniī vīs.	There existed in that man almost a divine (or a really heroic) force of character.
361	Prōgreditur rēs pūblica nātūrālī quōdam itinere et cursū.	The state advances in a natural path and progress.
362	Alcidamās quīdam.	One Alcidamas.
362	Alcidamās nescio quis.	An obscure person called Alcidamas.
363	Inest nescio quid in animō ac sēnsū meō.	There is something in my mind and feelings.
363	Bonī sunt nescio quō modō tardiōrēs.	Good people are somehow or other rather sluggish.
363	Nescio quō pactō ēvēnit ut...	Somehow or other it happened that...
364	Crās tibi quodcumque volēs dīcere licēbit.	Tomorrow you may say whatever you like.
364	Quisquis hūc vēnerit, vāpulābit.	Whoever comes here shall be beaten.
365	Īdem sum quī semper fuī.	I am the same as I have always been.
365	Incidit in eandem invidiam quam pater suus.	He fell into the same odium as his father.
366	Quidquid honestum est, idem est ūtile.	Whatever is right, is also expedient.
366	Accūsat mē Antōnius, īdem laudat.	Antonius accuses and at the same time praises me.
366	Īdem vir fortissimus, īdem ōrātor ēloquentissimus.	At once a man of the highest courage and the most eloquent of speakers.
367	Aliō ac tū est ingeniō.	He is of a different disposition from you.
367	liter atque sentit loquitur.	His language is different from his real sentiments.
368	Cōnsulum alter domī, alter mīlitiae, fāmam sibi parāvit.	One of the consuls won glory at home, the other in war.
368	Duōrum frātrum alter mortuus est.	One of the two brothers is dead.
368	Amīcus est tamquam alter īdem.	A friend is a second self.
368	Diēs ūnus, alter, plūrēs intercesserant.	One, two, several, days had passed.
369	Tum aliī Rōmam versus, in Etrūriam aliī, aliī in Campāniam, domum reliquī dīlābuntur.	Thereupon they disperse, some towards Rome, some towards Etruria, some towards Campania, the rest towards their homes.
370	Aliud est maledīcere, accūsāre aliud.	There is a vast difference between reviling and accusing.
370	Aliud loquitur, aliud facit.	His language is irreconcilable with his actions.
371	Hī omnēs alius aliā ratiōne rem pūblicam auxērunt.	All of these by different methods promoted the interests of the nation.
371	Aliī aliunde congregantur.	They flock together from various quarters.
371	Omnēs alius aliter sentīre vidēminī.	All of you, it seems, have different views.
371	Dīversī fugiunt.	They fly in opposite directions.
371	Tum omnēs alius alium intuēbāmur.	Thereupon all of us began to look at each other.
371	At frātrēs alter alterum adhortārī...	But the two brothers began to encourage each other, etc.
372	Quī cēterōs ōdit, ipse eīs odiō erit.	He who hates his neighbours will be hated by them.
373	Rōmānī domum, cum suā quisque praedā, redeunt.	The Romans return home, each with his own booty.
374	Mīlitēs, quem quisque vīderat, trucīdābant.	The soldiers would butcher whomever any of them saw.
374	Nōn meum est statuere quid cuique dēbeās.	It is not for me to determine your debt to each.
374	Suum cuique tribuitō.	Give to every one his due.
375	Fortissima quaeque cōnsilia tūtissima sunt.	The bravest plans are always the safest.
375	Haec optimus quisque sentit.	These are the views of every good man.
376	Optimum quidque rārissimum est.	Things are rare in proportion to their excellence.
376	Ut quisque est sollertissimus, ita fermē labōris est patientissimus.	In proportion to a man’s skill is, as a rule, his readiness to endure toil.
377	Quīntō quōque annō.	Every five years.
377	Decimus quisque.	Every tenth man.
377	Quotus quisque.	How few.
377	Prīmum quidque videāmus.	Let us look at each thing in turn, take each in turn as first.
377	Prīmō quōque tempore.	At the earliest opportunity possible.
378	Propter utramque causam.	For both reasons.
378	Quī utrumque probat, ambōbus dēbet ūtī.	He who approves of each of these separately is bound to use them both together.
378	Alter ambōve.	One or both.
378	Hōrum uterque.	Each of these.
378	Quantum inter rem utramque intersit, vidēs.	You see the great difference between the two things.
379	Uter utrī plūs nocuerit, dubitō.	I am doubtful which of the two injured the other most.
380	Cum singulīs vestīmentīs exeant.	Let them go out each with one set of garments.
380	Eius modī hominēs vix singulī singulīs saeculīs nāscuntur.	Such men come into the world scarcely once in a century.
380	Rōmānōs singulōs dīligimus, ūniversōs āversāmur.	While we feel affection for individual Romans, we loathe them as a nation.
380	Nec vērō ūniversō sōlum hominum generī, sed etiam singulīs prōvīsum est.	Nor is it only mankind in general, but the individual that has been cared for.
383	Ad bene vīvendum.	For living well.
383	Parcendō hostibus.	By sparing the enemy.
383	Orbem terrārum subigendō.	By conquering the world.
384	Docēre mihi iūcundum est.	Teaching is pleasant for me.
384	Ars docendī.	The art of teaching.
384	Homō ad agendum nātus est.	Man was born for action.
385	Cupiditās plūra habendī.	The desire to possess more.
385	Ad pācem petendam vēnērunt.	They cane to seek peace.
386	Vir laudandus.	A man to be praised.
387	Carthāgō dēlenda est.	Carthage must be destroyed.
387	Studiōsus est pācis petendae.	He is eager to seek peace.
387	Caesare interficiendō rem pūblicam restituere cōnātī sunt.	They tried to restore the republic by slaying Caesar.
387	Illī violandīs lēgātīs interfuēre.	They took part in the outrage on the ambassadors.
388	Amīcī tibi cōnsōlandī sunt.	You must console your friends.
388	Ōmnia ūnō tempore erant agenda.	Everything had to be done at one and the same time.
389	Agitandumst vigiliās.	One must keep watch.
389	Aeternās poenās in morte timendum est.	One must fear eternal punishment in death.
389	Haec ūtenda sunt.	These things must be used.
389	Hostibus parcendum est.	One must spare the enemy.
389	Occāsiōne ūtendum fuit.	The opportunity ought to have been used.
389	Gaius cōnsulendus est.	Gaius must be consulted.
389	Gaiō cōnsulendum est.	The interests of Gaius must be consulted.
390	Hostēs tibi vincendī sunt.	You must overcome your enemies.
390	Suō cuique iūdiciō ūtendum est.	Each man must use his own judgment.
391	Cīvibus ā tē cōnsulendum est.	You must consult the interests of the citizens.
391	Hostibus ā nōbīs parcendum erat.	We ought to have spared the enemy.
392	Mihi scrībendum fuit.	I should have written.
392	Tibi scrībendum erit.	You shall have to write.
392	Hostēs tum dēbellandī fuēre.	The enemy should have been conquered then.
392	Dīxit sibi scrībendum esse.	He said that he had to write.
392	Dīxit rem perficiendam fuisse.	He said that the matter should have been finished.
393	Cum haud irrīdendō hoste pugnāvī.	I have fought with no despicable foe (no fit object for ridicule).
394	Calamitās vix toleranda.	Scarcely endurable calamity.
395	Ad Gallōs īnsequendōs.	For pursuing the Gauls.
395	Ūtile bellō gerendō.	Useful for waging war.
395	Studium plūra cognōscendī.	Zeal for learning more.
395	Honestum petendō glōriam cōnsecūtus est.	He won glory by pursuing virtue.
395	Arma capiendī facultās...	The chance of taking arms...
396	Ad cōnsultandum hūc vēnimus.	We have come here to deliberate.
396	Ad pācem petendam missī sumus.	We have been sent for the purpose of asking for peace.
397	Legendō dabat operam.	He was giving his attention to reading.
397	Bellō gerendō mē praefēcistis.	You put me in control of the conduct of the war.
397	Comitia cōnsulibus creandīs.	The meeting for the election of consuls.
397	Solvendō nōn esse.	Not to be able to pay one’s debts.
398	Ūnus homō nōbīs cūnctandō restituit rem.	One man restored our fortunes by his delays.
398	Ōrātōribus legendīs dēlector.	I find delight in reading orators.
398	Ex discendō capiunt voluptātem.	They gain pleasure from learning.
399	Cupidus urbis videndae.	Desirous of seeing the city.
399	Quī hic mōs obsidendī viās?	What sort of a way is this of blocking up the roads?
399	Suī purgandī causā adsunt.	They are here to clear themselves.
399	Respīrandī spatium.	A breathing space.
399	Colligendī facultās.	An opportunity of rallying.
399	Pācis faciendae auctor et prīnceps fuī.	I suggested and was the leader in making peace.
399	Hoc cōnservandae lībertātis est.	This tends to the preservation of freedom.
400	Obsidēs Aeduīs custōdiendōs trādit.	He hands over the hostages to the Aedui, to keep in guard.
400	Agrōs eīs habitandōs dedit.	He gave them lands to dwell in.
400	Caesar pontem faciendum cūrāvit.	Caesar had a bridge made.
402	Pācem nōs flāgitātum vēnērunt.	They have come to importune us for peace.
403	Rūmor vēnit datum īrī gladiātōrēs.	The rumour came that a show of gladiators was going to be given.
404	Difficile est dictū quantō sīmus in odiō.	It is hard to say how hated we are.
404	Nefās est dictū tālem senectūtem miseram fuisse.	It is sacrilege to say that such an old age was wretched.
404	Facile audiēbātur; eum audīre facile erat.	It was easy to hear him.
405	Rēs abstrūsa ac recondita.	A deep and mysterious question.
405	Multī occīsī sunt.	Many were slain.
406	Caesar haec veritus.	Caesar fearing this.
406	Haec scrībēns interpellātus sum.	I was interrupted while I was writing this.
406	Urbem oppugnātūrus cōnstitit.	He halted when he was on the point of assaulting the city.
406	Nōbilēs, imperiō suō iamdiū repugnantēs, ūnō proeliō oppressit.	He crushed in a single battle the nobles, who had long been contesting his sovereignty.
406	Mīlitem arreptum trahēbat.	He seized the soldier and began to drag him off.
406	Patrem secūtus ad Hispānaiam nāvigāvit.	He followed his father and sailed to Spain.
410	Haec dīxit moriēns.	He said this while dying.
410	Prōvinciā dēcēdēns1 Rhodum praetervectus sum.	While returning home from my province, I sailed past Rhodes.
410	Ad mortem euntī obviam factus sum.	I met him as he was going to death.
410	Audīvī tē dīcentem.	I heard you say.
410	Aedēs flammantēs vīdit.	He saw the house blaze.
412	Rē cōnsentientēs, verbīs discrepāmus.	Though we agree in substance, we differ in words.
413	Vērum dīcentibus semper cēdam.	I will always yield to those who speak the truth.
413	Pugnantium clāmōre perterritus.	Alarmed by the shouts of the combatants, or of those who were fighting.
413	Nescio quem prope adstantem interrogāvī.	I questioned some bystander.
414	Interrogantī mihi respondi.	He replied to my question.
414	Lūgentium lacrimae.	The tears of mourning.
414	Grātulantium clāmōrēs.	Shouts of congratulation.
414	Vōx eius morientis.	His dying words.
414	Adhortantis verba.	His words of encouragement.
415	Haec locūtus aciem īnstrūxit.	Having spoken thus, he drew up his battle line.
415	Urbem captam incendit.	He burned the city which he had taken.
416	Metellum esse ratī, portās clausēre.	Having thought it was Metellus, they closed the gates.
417	Post urbem conditam.	After the foundation of the city.
417	Violātī foederis poenās dabis.	You shall be punished for the violation of the treaty.
417	Nūntiāta clādēs.	The news of the disaster.
418	Hoc sē umquam factūrum fuisse negat.	He says he would never have done this.
418	Numquam futūrum fuisse ut urbs caperētur respondit.	He replied that the city would never have been taken.
418	Adeō territī sunt ut arma facile trāditūrī fuerint.	They were so terrified that they would have easily delivered up their arms.
418	Nōn vereor nē domum numquam sīs reditūrus.	I am not afraid that you will never return home.
419	Caesar, acceptīs litterīs, proficīscī cōnstituit.	Caesar, letters having been received, decided to set out.
420	Hīs audītīs rediit.	Having heard this he returned.
420	Tē praesente.	In your presence.
420	Hōc compertō scelere.	In consequence of discovering this crime.
420	Tē repugnante.	In spite of your resistance.
420	Illō manente.	As long as he remains.
420	Antōniō oppressō.	If Antony is crushed.
420	Patefactā portā ērūpit.	He had the gate opened and sallied forth.
422	Caesar captōs hostēs trucīdāvit.	Caesar having taken the enemy massacred them.
422	Haec legēns tē vīdī.	As I was reading this I saw you.
424	Mē invītō.	Against my will.
424	Tē duce.	Under your leadership.
424	Mē auctōre.	At my suggestion
424	Salvīs lēgibus.	Without violating the law.
424	Honestīs iūdicibus.	If the judges are honourable men.
424	Missīs quī rogārent.	Having sent people to ask.
424	Compertō eum aegrōtāre.	Having ascertained that he was ill.
425	Tē nōn adiuvante.	Without your assistance.
425	Nūllō exspectātō duce.	Without waiting for any guide.
425	Rē īnfectā.	Without success.
425	Nūllō respondente.	Without receiving an answer from any one.
425	Causā incognitā.	Without hearing the case.
425	Indictā causā condemnātur.	He is being condemned without pleading his cause.
428	Quae ubi audīvit, abiit.	When he heard this he took his departure.
428	Quae postquam audierit, abībit.	After he hears this, he will go away.
428	Hostēs, ubi aliquōs ēgredientēs cōnspexerant, adoriēbantur.	Whenever the enemy saw any soldiers disembarking, they attacked them.
428	Ūndecimō diē postquam ā tē discesseram, litterās scrīpsī.	Ten days after I left you, I wrote a letter.
429	Cum vidēbis, tum sciēs.	When you see, you will know.
429	Poenam luēs, cum vēnerit solvendī diēs.	You will pay the penalty when the day of payment comes.
429	Decem sunt annī cum haec facis.	You have been doing this for the last ten years.
430	Caesar, cum haec vidēret, mīlitēs impetum facere iussit.	Caesar, seeing this, ordered his troops to charge.
430	Lēgātī, cum haec nōn impetrāssent, domum rediērunt.	The ambassadors having failed to obtain this, returned home.
431	Cum tū ibi erās, tum ego domī eram.	At the time you were there, I was at home.
432	Cum rosam vīderat, tum vēr esse arbitrābātur.	Whenever he saw the rose in bloom, he judged that it was spring-time.
432	Cum ad vīllam vēnī, hoc ipsum nihil agere mē dēlectat.	As often as I come to my country-house, this mere doing nothing has a charm for me.
432	Ut quisque hūc vēnerat, haec loquēbātur.	Whenever any one came here, he would use this language.
432	Quōs cessāre vīderat, verbīs castīgābat.	Whomever he saw hanging back, he made a point of rebuking.
432	Id fētiālis ubi dīxisset, hastam immittēbat.	As soon as the herald had uttered this, he would launch a spear.
433	Iam vēr appetēbat, cum Hannibal ex hībernīs mōvit.	Spring was already approaching, when Hannibal left his winter quarters.
434	Quae cum ita sint, Rōmam ībō.	Seeing that these are the circumstances, I will go to Rome.
434	Cum līber esse possit, servīre māvult.	Although he might be free, he prefers to be a slave.
434	Cum dīcere dēbēret, conticuit.	Although he ought to have spoken, he held his peace.
435	Cōnsilia cum patriae tum sibi inimīca capiēbat.	He conceived plans that were harmful both to his country and to himself.
435	Cum tē semper amāvī, tum meī amantissimum cognōvī.	Not only have I always felt affection for you, but I have found you most affectionate towards myself.
435	Cum tē semper dīlēxerim, tum hodiē multō plūs dīligō.	Not only I have always loved you, but I love you far more now.
437	Haec, fēcī, dum licuit.	I did this as long as I was permitted.
437	Vīvet eius memoria, dum erit haec cīvitās.	His memory will live as long as this country exists.
438	Dum haec geruntur, hostēs discessērunt.	While these things were being done, the enemy departed.
438	Allātum est praedātōrēs, dum lātius vagantur, ab hostibus interceptōs.	News was brought that the plunderers, while they were wandering too far, had been cut off by the enemy.
439	Ōderint, dum metuant.	Let them hate, provided they fear.
439	Veniant igitur, dum nē nōs interpellent.	Let them come then, provided they don’t interrupt us.
439	Maneant ingenia senibus, modo permaneat studium et industria.	Let the aged retain their faculties provided their zeal and industry persist.
440	Manē hīc, dum ego redierō.	Remain here till I return.
440	In senātū fuit quoad senātus dīmissus est.	He was in the senate till the moment when it was adjourned.
441	Num exspectātis dum testimōnium dīcat?	Are you waiting till he gives his evidence?
441	Epamīnōndās ferrum in corpore retinuit, quoad renūntiātum est vīcisse Boeōtiōs.	Epaminondas retained the spear in his body, till it was reported to him that the Boeotians were victorious.
441	Differant, dōnec īra dēfervēscat.	Let them put off till their anger cools.
442	Quārtō ante diē quam hūc vēnī litterās accēpī.	I received the letter four days before I came here.
442	Priusquam ē pavōre reciperēmus animōs, impetum fēcērunt hostēs.	The enemy made a charge before we should recover from the panic.
442	Priusquam incipiās, cōnsultō opus est.	Before men begin, they require deliberation.
443	Nōn prius respondēbō quam tacueris.	I will not answer until you are silent.
443	Nōn prius abiit quam iūdicum sententiās audīvit.	He did not go without hearing the verdict of the jury.
443	Tum dēmum respondēbō, cum tacueris.	I will not answer till you are silent.
445	Rōmulus urbem condidit.	Romulus founded a city.
445	Dīcunt Rōmulum urbem condidisse.	They say that Romulus founded a city.
445	Creāte cōnsulēs.	Elect consuls.
445	Hortātus est creārent cōnsulēs.	His advice was that they should elect consuls.
445	Lēgātōs ad Caesarem mittunt: sēsē parātōs esse portās aperīre.	They send ambassadors to Caesar (who said) “We are ready to open the gates.”
445	Colōnīs trīste respōnsum redditum est: facesserent properē ex urbe.	The colonists received a severe answer: “Begone at once from the city.”
446	Cōnstat tē patriam amāre.	It is agreed that you love your country.
446	Dīxērunt cōnstāre illum patriam amāre.	They said that it was agreed that you loved your country.
446	Stultus est quī hoc facit.	He who is doing this, is foolish.
446	Dīcō eum stultum esse quī hoc faciat.	I say that he who is doing this, is foolish.
446	Simul atque hostem vīdērunt, fūgēre.	As soon as they saw the enemy, they fled.
446	Dīcunt eōs simul atque hostem vīderint, fūgisse.	They say that as soon as the others saw the enemy, they fled.
447	Quī hoc fēcerint, poenās dabunt.	Those who shall have done this, will pay the penalty.
447	Dīxit eōs quī illud fēcissent, poenās datūrōs esse.	He said that those who did this, would pay the penalty.
448	Supplicātiō dēcrēta est, quod Italiam bellō līberāssem.	A thanksgiving was decreed because I had saved Italy from war.
448	Sōcratēs accūsātus est quod corrumperet iuventūtem.	Socrates was accused of corrupting the young men.
449	Themistoclēs certiōrem eum fēcit, id agī, ut pōns, quem ille in Hellēspontō fēcerat, dissolverētur.	Themistocles sent him word that the intention was to break down the bridge, which he (Xerxes) had made over the Hellespont.
450	Sī hoc dīcit, errat.	If he says this, he is making a mistake.
450	Sī hoc dīcat, erret.	If he were to say this, he would be wrong.
451	Sī spīrat, vīvit.	If he is breathing, he is alive.
451	Sī ēmī, meum est.	If I bought it, it is mine.
451	Sī valēs, gaudeō.	If you are well, I am glad.
451	Parcite Lentulī dignitātī, sī ipse fāmae suae umquam pepercit.	Show respect for the rank of Lentulus, if he ever showed respect for his own reputation (ironical).
452	Sī eum occīdī, rēctē fēcī.	If I slew him, I did rightly.
452	Excitāte eum, sī potestis, ab īnferīs.	Raise him from the underworld, if you have the power.
452	Moriar, sī vēra nōn loquor.	May I die, if I am not speaking the truth.
453	Hoc sī fēceris, poenās dabis.	If you do this, you will be punished.
453	Dā mihi pōculum, sī habēs.	Give me the cup, if you have it.
453	Venī crās, sī poteris.	Come tomorrow, if you can.
454	Sī quem cessāre vīderat, nōn verbīs sōlum sed etiam verberibus castīgābat.	If he saw that any one was hanging back, he would correct him, not with words only, but with a flogging.
455	Sī veniās, gaudeam.	If you were to come, I should be glad.
456	Hanc viam sī asperam esse negem, mentiar.	If I were to deny that this road is hard, I should lie.
456	Sī gladium quis apud tē sānā mente dēposuerit, repetat īnsāniēns, reddere peccātum sit, officium nōn reddere.	If a man in sound mind were to have deposited a sword with you and reclaim it when mad, it would be wrong to return it, right not to return it.
457	Sī vēnissēs, gāvīsus essem.	If you had come, I should have been glad.
458	Sī amīcī adessent, cōnsiliī nōn indigērem.	If my friends were here to help, I should not be in need of a plan.
458	Sī ibi tē esse scīssem, ad tē ipse vēnissem.	If I had known you were there, I should have come myself.
458	Sī ad centēnsimum annum vīxisset, senectūtis eum suae paenitēret?	If he had lived to his hundredth year, would he be regretting his old age?
458	Nisī ante Rōmā profectus essēs, nunc eam certē relinquerēs.	If you had not previously left Rome, you would certainly leave it now.
459	Ex eō, num valēret, quaesīvit.	He asked him if he was well.
461	Dēlērī tōtus exercitus potuit, sī fugientēs persecūtī victōrēs essent.	The whole army might have been destroyed, if the victors had pursued the fugitives.
461	Bonus vātēs poterās esse, sī voluissēs.	You might have been a good prophet, if you had cared to be one.
461	Hunc hominem, sī ūlla in tē esset pietās, colere dēbēbās.	If you had had any natural affection, you ought to have respected this man.
461	Sī ūnum diem morātī essētis, moriendum omnibus fuit.	If you had delayed a single day, you must all have died.
461	Hōs nisi manū mīsisset, tormentīs etiam dēdendī fuērunt.	If he had not set these men free, they must have been given up to torture
462	Quod nī ita sit, quid venerāmur deōs?	And if this were not so, why do we honour the gods?
462	Pōns iter paene hostibus dedit, nī ūnus vir fuisset.	The bridge almost gave a passage to the enemy, had it not been for one man.
462	Sī frāctus illābātur orbis, impavidum ferient ruīnae.	If the vault of heaven should break and fall, its crash will smite him unafraid.
463	Relictūrī agrōs erant, nisi Metellus litterās mīsisset.	They were about to abandon the territory had not Metellus sent a message.
463	Aliter sī fēcissēs, idem ēventūrum fuit.	Had you acted otherwise, the result would have been the same.
463	Melius erat, sī numquam vēnissēs.	It would have been better if you had never come.
464	Moriētur, nisi medicum adhibuerit.	Unless he calls in a physician, he will die.
464	Moriētur, sī medicum nōn adhibuerit.	He will die, if he fails to call in a physician.
464	Dolōrem sī nōn potuerō frangere, tamen occultābō.	If I cannot suppress my sorrow, yet I will hide.
464	Sī fēceris, habēbō grātiam, sī nōn fēceris, ignōscam.	If you do it, I shall thank you; if not, I shall pardon you.
465	Sī lūna clāra est, domō exeunt, sīn obscūrior, domī manent.	If the moon is bright, they leave their houses, but if it is at all dim they stay at home.
465	Sī haec fēcerit, gaudēbō, sī minus aequō animō feram.	If he does this, I shall be glad; if not, I shall take it quietly.
466	Nihil aliud discere est, nisi recordārī.	Learning is nothing else than recollecting.
466	Cum spē, sī nōn optimā, at aliquā tamen vīvit.	He lives with some hopes, if not the highest.
466	Iūrāvit sē, nisi victōrem, numquam reditūrum.	He swore never to return, unless victorious.
467	Sīve adhibueris medicum, sīve nōn adhibueris, convalēscēs.	You will get well, whether you call in a physician or not.
467	Seu legit, seu scrībit, nihil temporis terit.	Whether he reads or writes, he wastes no time.
467	Utrum legat an scrībat nescio.	I do not know whether he is reading or writing.
467	Aut legit aut scrībit.	He is either reading or writing.
468	Ōderint, dum metuant.	Let them hate, provided they fear.
468	Maneat, modo taceat.	Let him remain provided he holds his tongue.
468	Ita maneat, ut mihi pāreat.	Let him remain provided he obeys me.
