rule	lat	eng
280	Pācem bellō mūtāvit.	He exchanged peace at the cost of war.
280	Vēnditōrī expedit rem vēnīre quam plūrimō.	It is for the interest of the seller that the thing should be sold for as high a price as possible.
280	Multō sanguine victōria nōbīs stetit.	The victory cost us much blood.
281	Hannibal, cum victōriā posset ūtī, fruī māluit.	Hannibal, at a time when he might have used his victory, preferred enjoying it.
281	Mortis perīculō dēfūnctī sumus.	We have got over the danger of death.
281	Nostrī victōriā potītī sunt.	Our soldiers gained the victory.
282	Tē familiāriter, tē amīcō ūsus sum.	I was on intimate terms with you.
283	Honōre tē affēcī.	I conferred on you a distinction.
283	Poenā eum afficiam.	I will inflict punishment on him.
283	Honōribus tē cumulāvimus.	We have heaped honours on you.
283	Omnī observantiā eum prōsecūtus sum.	I have paid him every kind of respect.
284	Nāvēs mīlitibus onerat.	He loads the ships with soldiers.
284	Flūmen piscibus abundat.	The river is full of fish.
284	Mortuī cūrā et dolōre carent.	The dead are free from anxiety and pain.
284	Rēs maximē necessāriae nōn tam artis indigent quam labōris.	The most necessary things do not require skill so much as labour.
285	Vir omnī honōre dignus.	A man worthy of every distinction.
285	Vir maximō ingeniō praeditus.	A man endowed with remarkable ability.
285	Dīvitiīs opibusque frētus.	Relying on his wealth and resources.
286	Ubi rēs adsunt, quid mihi verbīs opus est?	When facts are here, what need have I of words?
286	Ait sibi cōnsultō opus esse.	He says he has need of deliberation.
286	Dux nōbīs et auctor opus est.	We need a leader and adviser.
286	Quae nōbīs opus sunt.	All the necessaries of life.
286	Quid haec scrībere opus est?	What need is there to write this?
288	Librī Cicerōnis.	Cicero’s books.
288	Hominum optimus.	The best of men.
288	Mortis fuga.	Flight from death.
288	Helvētiōrum iniūriae populī Rōmānī.	The wrongs done by the Helvetii to the people of Rome.
288	Mortis remedium.	A remedy against death.
288	Fossa quīndecim pedum.	A trench fifteen feet wide.
288	Lēgum oboedientia.	Obedience to law.
288	Corporis rōbur.	Bodily strength.
288	Āmissī fīliī dolor.	Pain for the loss of his son.
289	Caesaris causā; meā causā.	On behalf of Caesar; on my behalf.
298	Tuā operā.	With your aid.
290	Pompeiī aequālis ac meus.	Pompey’s contemporary and my own
290	Noster atque omnium parēns.	Our own, and the universal parent
290	Scēptrum rēgis.	The king’s sceptre
290	Illud Platōnis.	That saying of Plato
290	Suī iūris facere; suae diciōnis facere.	To bring under one’s own power.
291	Tālia dīcere sapientis est.	It is the mark of a wise man to speak thus.
292	Imbēcillī animī est superstitiō.	Superstition betrays a weak mind.
292	Iūdicis est lēgibus pārēre.	It is the part of a judge to obey the law.
292	Ingeniī hoc magnī est.	This requires great abilities.
292	Cuiusvīs hominis est errāre.	Any man may err.
292	Meum est.	It is my business.
292	Summae est dēmentiae.	It is the height of madness.
292	Temporī cēdere semper sapientis est habitum.	It has always been held a wise thing to yield to circumstances.
292	Hoc dēmentiae esse summae dīxit.	He said that this showed the height of madness.
292	Hoc suī esse arbitriī negāvit.	He said that this did not depend upon his own decision.
292	Hoc ēvertendae esse reī pūblicae dīxit.	He said that this tended to the destruction of the constitution.
293	Ūnus omnium īnfēlīcissimus.	The most unfortunate of all mankind.
293	Tū maximē omnium.	You most of all.
293	Uterque vestrum.	Each of you two.
293	Multī hōrum.	Many of these.
293	Duo hōrum.	Two of these.
293	Quotus quisque philosophōrum.	How few of philosophers.
294	Quantum voluptātis.	How much pleasure.
294	Plūs dētrīmentī.	Greater loss.
294	Nihil praemiī.	No reward.
294	Parum vīrium.	Insufficient strength.
294	Quid novī?.	What news?.
294	Nimium temporis.	Too much time.
294	Hoc ēmolumentī.	This gain.
294	Quid hoc rēī est?.	What is the meaning of this?.
294	Tum temporis.	At that time.
294	Eō audāciae.	To such a pitch of boldness.
294	Ubi gentium.	Where in the world?
294	Cum id aetātis puerō.	With a boy of that age.
294	Ad id locōrum.	Up to that point of time.
295	Aliquid humile.	Something degrading.
295	Media urbs.	The middle of the city.
295	Ad multum noctem.	To a late hour.
295	Tantō sanguine.	At the cost of so much blood.
296	Dē tot mīlibus vix paucī superfuēre.	Of so many thousands scarcely a few survived.
297	Equitēs, quī paucī aderant.	The cavalry, few of whom were there.
298	Nihil reliquī fēcit.	He left nothing remaining.
298	Nihil pēnsī habuit.	He cared not at all.
300	Litterārum studium.	Devotion to literature.
300	Dolōris remedium.	A remedy against pain.
300	Reī pūblicae dissēnsiō.	A political disagreement.
300	Pyrrhī rēgis bellum.	The war with King Pyrrhus.
300	Suī fīdūcia.	Confidence in one’s self.
300	Lēgum oboedientia.	Submission to the law.
300	Deōrum opīniō.	An impression about the gods.
301	Rērum novārum cupidus.	Desirous of change.
301	Mīlitiae ignārus.	Ignorant of warfare.
301	Imperiī capāx.	With a capacity for rule.
301	Reī pūblicae perītus.	Skilled in the management of the state.
301	Pugnandī īnsuētus.	Unaccustomed to fighting.
301	Litterārum studiōsissimus.	Most devoted to literature.
301	Huius sceleris particeps.	With part in this guilt.
301	Beneficiī immemor.	Apt to forget a favour.
301	Certiōrem mē suī cōnsiliī fēcit.	He informed me of his plan.
302	Rēgnum appetēns.	While aspiring to the crown.
302	Rēgnī appetēns.	Aspiring to kingly power (habitually, or by character.)
302	Iūris cōnsultus.	One consulted in law.
303	Vir summae fortitūdinis.	A man of the greatest courage.
303	Septuāgintā nāvium classis.	A fleet of seventy ships.
303	Vīgintī pedum erat agger.	The embankment was twenty feet high.
303	Puer tredecim annōrum.	A boy thirteen years old.
303	Prōvectae aetātis homō.	A man advanced in years.
303	Tot annōrum fēlīcitās.	So many years of good fortune.
303	Quīndecim diērum supplicātiō.	A thanksgiving of fifteen days’ duration.
303	Optimae speī adulēscēns.	A youth of the highest promise.
303	Senex cānīs capillīs et veste sordidā.	An old man with white hair and unclean garments.
303	Fac bonō sīs animō.	Be of good cheer.
304	Urbs Saguntum.	The city of Saguntum.
304	Īnsula Britannia.	The island of Britain.
304	Rēs Rōmānae.	The affairs of Rome.
304	Cīvis Thēbānus.	A citizen of Thebes.
305	Tē in diēs plūris faciō.	I value you more highly every day.
305	Rem pūblicam nihilī habet, salūtem suam maximī.	He sets no value on the national cause, the highest on his own safety.
305	Ēmit hortōs tantī quantī Pythius voluit.	He bought the pleasure-grounds at exactly at the price that Pythius wished for.
305	Tua mihi amīcitia plūris est quam cēterōrum omnium plausūs.	Your friendship is of more value to me than the applause of all the world besides.
306	Prōditiōnis accūsāre, reum facere.	To accuse, to prosecute, for treachery.
306	Fūrtī ac repetundārum condemnātus est.	He was found guilty of theft and extortion.
306	Parricīdiī eum incūsat.	He taxes him with parricide.
306	Sacrilegiī absolūtus est.	He was acquitted of sacrilege.
306	Dē pecūniīs repetundīs damnārī.	To be condemned for extortion.
306	Aliquem dē ambitū reum facere.	To bring an action against a man for bribery
306	Dē vī sē pūrgāre.	To clear one’s self of assault.
307	Capitis damnātus est.	He was capitally condemned (i.e. to death or exile).
307	Octuplī condemnātus est.	He was condemned to pay eightfold.
307	Morte condemnātus est.	He was condemned to death.
307	Exsiliō multātus est.	He was punished with exile.
308	Rērum praeteritārum.	The past.
308	Venit mihi in mentem eius diēī.	I have a recollection of that day.
308	Foederis tē admoneō.	I remind you of the treaty.
308	Cāsum nostrum miserābātur.	He bemoaned our disaster.
309	Ignāvum paenitēbit aliquandō ignāviae.	The slothful man will one day repent of his sloth.
309	Mē nōn sōlum piget stultitiae meae, sed etiam pudet.	I am not only sorry for my folly, but also ashamed of it.
309	Taedet mē vītae.	I am weary of my life.
309	Tuī mē miseret.	I pity you.
309	Meī piget.	I am vexed with myself.
309	Taedet eadem audīre mīlitēs.	The soldiers are tired of hearing the same thing.
309	Paenitet nōs quod haec fēcimus.	We are sorry that we acted so.
309	Hoc pudet, illud paenitet.	This causes shame, that causes regret.
309	Pudet mē veterānōrum mīlitum.	I blush before the veterans.
310	Interest omnium rēctē facere.	It is the interest of all to do right.
310	Quid nostrā interest?	Of what importance is it to us?
310	Multum interest quōs quisque cottīdiē audiat.	It is of great consequence whom a man listens to every day.
310	Illud meā plūris interest tē ut videam.	It is of more consequence to me that I should see you.
310	Vestrā interest, commīlitōnēs, nē imperātōrem pessimī faciant.	It is of importance to you, my comrades, that the worst sort should not elect your commander.
310	Hoc et tuā et reī pūblicae interest.	This concerns both yourself and the nation.
310	Nihil meā interest quantī me faciās.	Your estimate of me is of no concern to me.
310	Magnī interest ad laudem cīvitātis haec vōs facere.	Your doing this is of great importance to the credit of the state.
312	Vīxī Rōmae, Tarentī, Carthāginī.	I lived at Rome, Tarentum, Carthage.
312	Pendēre animī.	To be in suspense.
313	Ad Cannās pugnātum est.	There was a battle at Cannae.
313	Ad urbem est.	He is in the neighbourhood of the city.
314	Rōmā venit.	He comes from Rome.
314	Tarquiniōs Corinthō fūgit.	He went into exile to Tarquinii from Corinth.
314	Rūre rediit.	He returned from the country.
315	He returned home from his friends at Corinth.	Corinthō ab amīcīs domum rediit.
315	He sent a dispatch to the senate at Rome.	Rōmam ad senātum litterās mīsit.
315	He returned to his friends in Africa.	In Āfricam ad amīcōs rediit.
316	In urbe Londiniō.	In the city of London.
316	Domī meae commorātus est.	He stayed at my house.
316	In vetere domō.	In his old home.
317	Archiās Antiochīae nātus est, celebrī quondam urbe.	Archias was born in the once famous city of Antioch.
317	Athēnās, in urbem praeclārissimam vēnī.	I reached the illustrious city of Athens.
317	Syrācūsīs, ex urbe opulentissimā, profectus est.	He set out from the flourishing city of Syracuse.
318	Trīduī iter prōcessit.	He advanced a three days’ march.
318	Ab officiō cavē trānsversum, ut aiunt, digitum discēdās.	Do not swerve “a finger’s breadth” from your duty.
318	Ariovistus vix duo mīlia passuum aberat.	Ariovistus was at a distance of scarcely more than two miles.
318	Mīlitēs aggerem lātum pedēs trecentōs exstrūxērunt.	The soldiers threw up a mound three hundred feet broad.
319	Bellum, quod populus Rōmānus cum Carthāginiēnsibus gessit.	The war between Rome and Carthage.
320	In bellō.	In time of war.
320	Bellō Pūnicō secundō.	In the second Punic war.
320	Alcibiadis temporibus.	In the time of Alcibiades.
321	Multōs iam annōs hīc domicilium habeō.	I have been living here for many years.
321	Annum iam vīcēnsimum rēgnat.	He has been king for the last twenty years.
322	Tribus post annīs classis rediit; tertiō post annō classis rediit.	The fleet returned after three years.
322	Paucīs diēbus ante eius mortem.	A few days before his death.
323	Annō trecentēnsimō alterō quam Rōma condita est; post trecentēnsimum alterum annum quam Rōma condita est.	Three hundred and two years after the foundation of Rome.
323	Prīdiē quam excessit ē vītā.	The day before his death.
323	Postrīdiē quam ā vōbīs discessī.	The day after I left you.
323	Posterō annō quam, etc.	The year after, etc.
323	Priōre annō quam, etc.	The year before, etc.
324	Abhinc annōs quattuor Vergilium vīdī.	I saw Vergil four years ago.
325	Decem annīs urbem capiēmus; intrā decem annōs urbem capiēmus.	We shall take the city in ten years.
325	Hīs tribus diēbus.	For the last three days.
325	Hōc bienniō.	Within two years from this time.
326	In diem vīvere.	To live for the day only.
326	In sex diēs indūtiae factae sunt.	A truce was made for six days.
326	Ad cēnam mē in posterum diem invītāvit.	He invited me to supper for the next day.
326	Ad Kalendās solvam.	I will pay by the first of the month.
326	Ad tempus.	At the appointed time, punctually.
326	Ex eō diē ūsque ad extrēmum vītae diem.	From that day to the very end of his life.
327	Annōs quīnque et octōgintā nātus excessit ē vītā.	He died at the age of eighty-five.
328	Iam Caesarem bellī taedēbat.	Caesar was now tired of war.
328	Quid hoc reī sit, iam intellegēs.	You will soon be aware of the meaning of this.
328	Iam diū.	Now for a long while.
328	Iam dūdum.	For a considerable time.
328	Rūrsus.	Once more.
328	Iterum.	A second time (opposed to semel or prīmum).
328	Dē integrō.	Afresh.
328	Saepe.	Again and again.
329	Alpibus tenus.	As far as the Alps.
331	Ad tē scrīpsī.	I wrote to you.
331	Ad haec respondit.	He replied in answer to this.
331	Ad cannās.	In the neighbourhood of Cannae.
331	Hoc ad nōs cōnservandōs pertinet.	This tends to our preservation.
331	Diēs ad urbis interitum fātālis.	The day destined for the ruin of the city.
331	Ad ūnum.	To a man (i.e. all).
331	Ad hoc.	Moreover.
331	Adversus castra nostra.	Opposite to our camp.
331	Ad versus tē contendam.	I will strive against you.
331	Ante aciem.	Before the battle line.
331	Ante mē.	Before my time.
331	Apud cannās.	Near Cannae.
331	Apud mē.	In my house.
331	Apud Xenophōntem.	In the writings of Xenophon.
331	Apud vōs contiōnātus est.	He made a speech in your hearing.
331	Apud mē.	In my judgment.
331	Apud vōs ille plūs valet.	He has more influence with you.
331	Circā tellūrem.	Round the earth.
331	Circā viam.	On both sides of the road.
331	Circā prīmam lūcem.	About dawn.
331	Citrā flūmen Rhēnum.	On this side of the Rhine.
331	Contrā urbem.	Opposite the city.
331	Contrā rem pūblicam facere.	To act unconstitutionally.
331	Contrā nōs bellum gerit.	He wages war against us.
331	Contrā spem.	Contrary to expectation.
331	Ergā mē benevolentissimus.	Full of kindness towards me.
331	Extrā urbem.	Outside the city.
331	Extrā culpam.	Free from blame.
331	Extrā ōrdinem.	Out of his proper order.
331	Inter hostium tēla.	Amid the enemy’s weapons.
331	Inter mē ac vōs hoc interest.	This is the difference between me and you.
331	Inter sē dīligunt.	They love each other.
331	Inter omnēs cōnstat.	All are agreed.
331	Omnia īnfrā sē esse iūdicat.	He holds that he is superior to all things.
331	Intrā tēlī iactum.	Within the cast of a javelin.
331	Intrā diem decimum.	Within ten days.
331	Iuxtā mūrum.	Near the wall.
331	Iuxtā cōnstitī.	I stood nearby.
331	Ob oculōs.	Before one’s eyes
331	Ob dēlictum.	Because of his fault.
331	Quam ob rem.	Wherefore, therefore.
331	Penes tē hoc est.	This depends on you.
331	Penes tē es?	Are you in your senses?
331	Per prōvinciam.	Through the province.
331	Per hōs diēs.	During the last few days.
331	Per mē licet.	You have my leave.
331	Per speculātōrēs.	By means of spies.
331	Per vim.	Violently.
331	Post tergum.	Behind one’s back.
331	Post hominum memoriam.	Since the dawn of history.
331	Praeter castra.	Beyond the camp.
331	Fortis praeter cēterōs.	Brave beyond the rest.
331	Praeter spem.	Contrary to hope.
331	Praeter tē ūnum omnēs.	All except you alone.
331	Prope mē.	Near to me.
331	Propius urbem.	Nearer to the city.
331	Propter mūrum.	Hard by the wall.
331	Propter sē.	For its own sake.
331	Propter tē salvus sum.	I am safe thanks to you.
331	Secundum flūmen.	Following the river.
331	Secundum nātūram.	In accordance with nature.
331	Secundum pugnam.	Immediately after the fight.
331	Secundum deōs.	Next to the gods.
331	Suprā terram.	Above the earth.
331	Supra vīrēs.	Beyond his strength.
331	Trāns Rhēnum.	Across the Rhine.
331	Rōmam versus.	In the direction of Rome.
331	Ultrā vīrēs.	Beyond his strength.
331	Athēnās in Graeciam exsulātum abiit.	He went into exile at Athens in Greece.
331	Exercitum in nāvēs impōnere, exercitum in terram expōnere.	To embark an army; to disembark an army.
331	In orbem sē colligunt.	Form a circle for defence.
331	In quārtum diem in hortōs ad cēnam invītāvit.	He gave an invitation to supper in his grounds four days from that time.
331	In praesēns.	For the present.
331	In diēs.	Daily.
331	In posterum.	For the future.
331	In mē invectus est.	He inveighed against me.
331	In rem pūblicam merita.	Services to the nation.
331	In hunc modum locūtus est.	He spoke in this way.
331	Sub ipsōs mūrōs adequitant.	They ride close up to the walls. 
331	Subter mūrōs venīre.	To come close up to the walls.
331	Super ipsum.	Next above the host at table.
331	Aliī super aliōs.	One after another.
332	Ab Āfricā.	From Africa.
332	Ā puerō.	From boyhood.
332	Ab urbe conditā.	From the foundation of the city.
332	Ā dextrō cornū.	From the right wing.
332	Ā fronte.	In front.
332	Ā senātū stāre.	To take the side of the senate.
332	Sēcūrus ab hoste.	Free from care as to the enemy.
332	Ā rē frūmentāriā labōrāre.	To be in distress for provisions.
332	Ā tē incipiam.	I will begin with you.
332	Cōnfestim ā proeliō.	Immediately after the battle.
332	Tēcum Romam rediī.	I returned to Rome in company with you.
332	Cum gladiō; cum sordidā veste.	Having a sword; wearing a squalid garment.
332	Cum febrī esse.	To suffer from fever.
332	Cum imperiō esse.	To be invested with military power.
332	Tēcum mihi amīcitia est.	I have friendship with you.
332	Tēcum bellum gerō.	I am waging war against you.
332	Hoc mēcum commūnicāvit.	He imparted this to me.
332	Maximō cum damnō meō.	To my great loss.
332	Cōram populō.	In the presence of the people.
332	Dē moenibus dēturbāre.	To drive in confusion from the walls.
332	Dē spē dēicere.	To disappoint.
332	Homō dē plēbe.	A man of the people.
332	Dē tē āctum est.	Tt is all over with you.
332	Dē viā languēre.	To be tired after a journey.
332	Dē industriā.	On purpose.
332	Bene merērī dē nōbīs.	To deserve well of us.
332	Poenās sūmere dē aliquō.	To punish someone.
332	Ex equō pugnāre.	To fight on horseback.
332	ē rēbus futūrīs pendēre.	To depend upon the future.
332	Ex sententiā.	According to one’s wish.
332	ē rēpūblicā.	In accordance with the constitution.
332	Ex imprōvīsō.	Unexpectedly.
332	Prae sē ferre.	To avow, make no secret of.
332	Prae clāmōre vix audīrī potuit.	He could scarcely be heard for the shouting.
332	Prae nōbīs beātus est.	He is happy compared with us.
332	Prō tribūnālī dīcere.	To speak from the magistrate’s tribunal.
332	Prō ārīs et focīs.	In defence of our altars and hearths.
332	Ūnus ille mihi prō exercitū est.	That one man is as good as an army to me.
332	Prō certō habēre.	To feel sure of, to consider as certain.
332	Prō meritīs eius grātiam reddere.	To render thanks in proportion to his deserts.
332	Prō prūdentiā tuā.	In accordance with your prudence.
332	Prō potestāte.	In virtue of your power.
332	Caedēs minor quam prō tantā victōriā.	Slaughter small in proportion to the greatness of the victory.
332	Sine dubiō.	Doubtless.
332	Nūllō negōtiō.	Without trouble.
332	Rē īnfectā.	Without result.
332	Nūllō repugnante.	Without resistance.
332	Imprūdēns.	Without being aware.
332	Stetit impavidus neque locō cessit.	He stood undismayed, without yielding ground.
332	Nōn potes mihi nocēre quīn tibi ipsī noceās.	You cannot hurt me without injuring yourself.
332	In bonīs dūcere.	To reckon among blessings.
332	In dēlīberandō.	Whilst deliberating.
332	Quae in oculīs sunt.	What is before our eyes.
332	In armīs esse.	Under arms.
332	Quantum in mē est.	To the utmost of my power.
332	Satis ut in rē trepidā impavidus.	With fair courage considering the critical state of things.
332	In tantō discrīmine.	In the face of such a crisis.
332	Sub terrā.	Under the earth.
332	Sub armīs.	Under arms.
332	Eō duce.	Under his guidance.
332	Subter lītore.	Close to the shore.
332	Super focō.	Upon the hearth.
333	Clam nostrōs.	Unknown to our men.
333	Pectoribus tenus.	As far as the chest.
333	Hāctenus; aliquātenus.	To this extent; to some extent.
334	Ego cum prīmum ad rem pūblicam accessī.	For myself, when first I entered on political life.
334	An tū praetōrem accūsās?	Are you bringing a charge against a praetor?
334	Hīs ego perīculīs me obiēcī.	These were the dangers to which I exposed myself.
334	Vir optimus tū quidem, sed mediocrī ingeniō.	You are an excellent man, but of moderate abilities.
337	Haec omnia.	Everything around us.
337	Piget haec perpetī.	It is painful to endure the present state of things.
337	Hīs sex diēbus.	In the last six days.
337	Hīs cognitīs.	After learning this (which I have just related).
338	Cūr ista quaeris?.	Why do you put that question of yours?
338	Opīniō ista.	That belief of yours.
338	Epicūrus iste.	Your friend Epicurus.
338	Cāsus iste.	Your present disaster.
338	Ista nōvimus.	We know that story.
338	Istī.	Those friends of yours (whom I think lightly of).
339	Illīs temporibus.	In those days.
339	Antīquitās illa.	The far-off past, the good old time.
339	Catō ille.	The great Cato.
340	Rōmulum Numa excēpit; hic pāce, ille bellō melior fuit.	To Romulus succeeded Numa; the latter excelled in peace, the former in war.
340	Neque hoc neque illud.	Neither the one nor the other.
340	Et hic et ille.	Both one and the other.
340	Hī pācem, bellum illī volunt.	Some desire peace, others war.
341	Nōtum illud Catōnis...	The well-known saying of Cato...
341	Illud vereor, nē famēs in urbe sit.	My real fear is lest there should be hunger in the city.
341	Nē illud quidem intellegunt...	They do not even perceive this, that...
342	In eōs quī dēfēcerant saevītum est.	The rebels were treated with severity.
343	Is sum quī fēcī.	I am the man who did it.
343	Nōn is sum quī faciam.	I am not such a person as to do it.
344	Decem captī sunt, et iī Rōmānī.	Ten men have been taken, and what is more those were Romans.
344	Litterīs operam dedī, idque ā puerō.	I have been a student, and that from my boyhood.
345	Nostrī nōbīs līberī cāriōrēs sunt quam amīcōrum.	Our own children are dearer to us that those of our friends.
347	Ea dēmum est vēra fēlīcitās.	This and this only is true good fortune.
348	Venit mihi in mentem diēī illīus, quō...	I remember the day on which...
348	Ea quae mihi tēcum erat amīcitia.	The friendship which existed between you and me.
349	Brūtus pugiōne sē interfēcit suō.	Brutus killed himself with his dagger.
349	Mīlitēs exhortātus est ut sē sequerentur.	He exhorted the soldiers to follow him.
349	Dīxit sē suīs amīcīs sua omnia datūrum.	He said that he would give to his friends all his property.
349	Scīre voluit vērum falsumne sibi esset relātum.	He wished to know whether what had been reported was true or false.
349	Mīlitēs, quī sē suaque omnia hostī trādiderant, laudāre nōluit.	He was unwilling to praise soldiers who had surrendered themselves and all that belonged to them to the enemy.
350	Ariovistus ad Caesarem lēgātōs mittit utī ex suīs (= Caesaris) aliquem ad sē (= Ariovistum) mitteret.	Ariovistus sent ambassadors to Caesar to ask that Caesar should send some one of his (Caesar’s) men to him (Ariovistus).
350	Rogāvit Caesar cūr dē suā virtūte aut dē ipsīus dīligentiā dēspērārent.	Caesar asked why they despaired of their own valour or of his zeal.
352	Dēfōrme est dē sē ipsum praedicāre.	It is unseemly to brag about oneself.
352	Aliēnīs iniūriīs vehementius quam suīs commovērī.	Being moved more deeply by other men’s wrongs than by one’s own.
352	Fīdūcia suī.	Self-confidence.
352	Quantum in sē fuit.	To the upmost of his abilities.
352	Suī compos.	Master of himself.
352	Tum illum vix iam suī compotem esse videt.	Then he sees that the other is scarcely any longer master of himself.
352	Haec omnia per sē ac propter sē expetenda esse ait.	All these things, he says, are desirable in themselves and for their own sake.
353	Fūrtim inter sē aspiciēbant.	They would look stealthily at each other.
354	Suus cuique erat locus attribūtus.	To each man his own place had been assigned.
354	Senātum ad suam sevēritātem revocāvī.	I recalled the senate to its strictness.
354	Auctōritās Pausistratī, quae inter suōs maxima erat...	The influence of Pausistratus, which was predominant amongst his followers...
354	Fīliī mortem dēplōrābat.	He was lamenting his son’s death.
354	Suō tempore.	At the time that suited him.
354	Suā sponte.	Of his own free will.
355	Quid ipsī sentiātis velim fateāminī.	I would fain have you confess your own sentiments.
355	Ipsīs sub moenibus.	Close beneath the walls.
355	illō ipsō diē.	On that very day.
355	Adventū ipsō hostēs terruit.	He frightened the enemy by his mere arrival.
355	Ipse hoc vīdī.	I saw this with my own eyes.
355	Ipse fēcī.	I did it unaided.
355	Ipsī venient.	They will come of their own accord.
356	Dīmissīs suīs ipse nāvem cōnscendit.	He dismissed his followers and embarked.
356	Meā ipsīus culpā; vestrā ipsōrum culpā.	Through my own fault; through your own fault.
357	Sī quis ita fēcerit, poenās dabit.	If any one does so, he will be punished.
357	Num quis īrāscitur īnfantibus?	Does anybody feel anger towards infants?
357	Nē quis aedēs intret, iānuam claudimus.	We shut the door to prevent any one from entering the house.
