rule	lat	eng
1	Avis canit; avēs canunt.	 The bird sings; the birds sing.
2	Rēx ille, vir iūstissimus, plūrima foedera pactus est.	That just king contracted many treaties.
3	Alexander, tot rēgum atque populōrum victor.	Alexander, the conqueror of so many kings and nations.
4	Sacerdōs hostiam cecīdit.	The priest struck down the victim.
4	Alius alium hortātur.	One man exhorts another.
4	Pontem fēcērunt.	They made a bridge.
5	Tibi faveō; tibi favētur.	I favour you; you are favoured.
5	Tibi pāreō; tibi pārētur.	I obey you; you are obeyed.
5	Tibi persuādeō; tibi persuādētur.	I persuade you; you are persuaded.
5	Tibi parcō; tibi parcitur.	I spare you; you are spared.
6	Hoc patrī meō dedī.	I gave this to my father.
6	Ad patrem vēnī.	I came to my father.
6	Prō patriā morī.	To die for one’s country.
7	Gaius est iūstus.	Gaius is a just man.
7	Scio Gaium iūstum fierī.	I know that Gaius is becoming just.
7	Gaius imperātor salūtātus est.	Gaius was saluted as Imperator.
8	Castra vallō fossāque ā mīlitibus mūnīta sunt.	The camp has been fortified by the soldiers with a rampart and ditch.
8	Cum tēlō vēnit.	He came with a weapon.
8	Cum Caesare hoc fēcī.	I did this with Caesar.
9	Hōc mēnse quīndecim diēs aegrōtāvī.	I have been ill for fifteen days in this month.
9	Trēs ibi diēs commorātus sum, quārtō diē domum rediī.	I stayed there three days, I returned home on the fourth day.
9	Rōmā vēnit.	He came from Rome.
9	Ab Italiāvēnit.	He came from Italy.
9	Neāpolim rediit.	He returned to Naples.
9	In Italiam rediit.	He returned to Italy.
9	Domō vēnit.	He came from home.
9	Rūs abiit.	He went off to the country.
10	Hortī patris.	My father’s gardens.
10	Laus ducis.	The praise of the general.
10	Fortium virōrum facta.	The deeds of brave men.
11	Ego hoc volō.	For myself I wish this.
11	Tū Tarentum āmīsistī, ego recēpī.	You lost Tarentum, I retook it.
11	Tum ille dextram porrigit.	Then he holds out his right hand.
11	Suō sē gladiō vulnerāvit.	He wounded himself with his own sword.
11	Patrem meum vīdī.	I have seen my father.
11	Hoc sē factūrum esse ait.	He says he will do it.
12	Ille est equus, quem ēmī.	Yonder is the horse which I have bought.
13	Dīvitiās optat, quās adeptūrus est numquam.	He is praying for riches, but will never obtain them.
14	Cum hoc audīvisset, rediit.	Having heard this, he returned.
15	They marvelled and went away.	Admīrātī abiēre.
15	He attacked and took the city.	Urbem oppugnātam cēpit.
16	Num cāsū factus est mundus?	Was the world (sun, moon, stars, and earth) made by chance?
16	Lūna circum tellūrem movētur.	The moon moves round the world (this planet).
16	Orbī terrārum imperābant Rōmānī.	The Romans were rulers of the world.
16	Omnēs hominēs īnsānīre eum crēdunt.	The whole world thinks him out of his mind.
16	Nēmō ūsquam.	No one in the world.
16	Multum hominibus nocuit.	He did the world much harm.
16	In hāc vītā numquam eum sum vīsūrus.	I shall never see him in this world.
21	He changed his seat.	Sēdem mūtāvit.
21	The weather is changing.	Mūtātur tempestās.
21	He broke up the crowd.	Multitūdinem dissipāvit.
21	The fog broke up.	Dissipāta est nebula.
21	He moved his arm.	Bracchium mōvit.
21	The moon moves round the earth.	Lūna circā tellūrem movētur.
21	He rolled down stones.	Lapidēs dēvolvit.
21	The stones roll down.	Dēvolvuntur lapidēs.
21	He will surrender the city.	Urbem dēdet.
21	The enemy will surrender.	Sē dēdent hostēs.
21	Riches increase.	Crēscunt dīvitiae.
21	He increased his wealth.	Opēs suās auxit.
21	He collected books.	Librōs collēgit.
21	A crowd was collecting.	Conveniēbat multitūdō.
23	Honōrēs petō.	I aim at high office.
23	øtium dēsīderō.	I crave for leisure.
23	Pācem spērō.	I hope for peace.
23	Tē audiō.	I listen to you.
23	Tē exspectō.	I wait for you.
23	Caelum suspiciō.	I look up at the sky.
23	Hoc optō.	I pray for this.
26	Et ego et tū manūs sustulimus.	Both you and I raised our hands.
26	Et tū et frāter meus manūs sustulistis.	Both you and my brother lifted up your hands.
27	Et tū ades et frāter tuus.	Both you and your brother are here.
28	Appius et soror eius et frāter meus manūs sustulērunt.	Appius and his sister and my brother lifted up their hands.
28	Nunc mihi nihil librī, nihil litterae, nihil doctrīna prōdest.	Now neither do books avail me, nor letters, nor does learning.
29	Neque tū adfuistī neque frāter tuus.	Neither you nor your brother was present.
30	Vult populus Rōmānus.	It is the wish of the Roman people.
30	Exercitus ē castrīs profectus est.	The army started from the camp.
30	Senātus dēcrēvit.	The senate decreed.
30	Magna pars fūgēre.	A large proportion of the men fled.
31	Haec mē fēcisse pudet.	I am ashamed of having done this.
31	Cōnstat Rōmam nōn sine labōre conditam esse.	It is agreed that Rome was not built without toil.
31	Manifēstum est nivem esse albam.	It is plain that snow is white.
32	Hostēs adesse dīxit.	He said that the enemy was near.
32	Respondit sē esse itūrum.	He answered that he would go.
32	Frātrem tuum fortem esse intellegō.	I perceive that your brother is a brave man.
32	Rem ita sē habēre videō.	I see that the fact is so.
32	Sentīmus calēre ignem.	We perceive-by-our-senses that fire is hot.
33	He says that he is not ready.	Sē parātum esse negat.
33	He said he would never do this.	Sē hoc umquam esse factūrum negāvit.
33	He says he has done nothing.	Negat sē quidquam fēcisse.
34	Hoc sē fēcisse negat.	He says that he himself did not do this.
36	Sē in Asiā esse dīcit.	He says that he is in Asia.
36	Sē in Asiā esse dīxit.	He said that he was in Asia.
36	Sē in Asiā fuisse dīcit.	He says has been in Asia.
36	Sē in Asiā fuisse dīxit.	He said that he had been in Asia.
36	Sē itūrum esse dīcit.	He says that he will go.
37	Spērat plērumque adulēscēns diū sē vīctūrum esse.	A young man generally hopes to live a long time.
37	Hoc sē factūrum esse minātus est.	He threatened to do this.
38	Spērāvit fore ut id sibi contingeret.	He hoped that this would fall to his lot.
38	Spērō fore ut dēleātur Carthāgō.	I hope that Carthage will be annihilated.
39	Hoc sē facere posse spērat.	He hopes he will be able to do this
40	“Domum,” inquit, “redībō.”	“I will,” says he, “return home.”
40	Domum sē reditūrum esse dīcit.	He says he will return home.
41	Mīlitēs abīre iussit.	He ordered  the soldiers to depart.
41	Tē venīre nōlō.	I do not wish you to come.
41	Tē incolumem rediisse gaudeō.	I rejoice that you have returned safely.
42	Cīvis Rōmānus fierī cupiō.	I am anxious to become a citizen of Rome.
42	Soleō ōtiōsus esse.	I am accustomed to be at leisure.
42	Morī mālō quam servus esse.	I had rather die than be a slave.
43	Dīcitur Cicerō cōnsul fuisse.	Cicero is said to have been consul.
43	Dīcor iūstus esse.	It is said that I am just.
43	Videor esse fortis.	I seem to be brave.
43	Vidētur esse cactus.	He seems to be blind.
43	Videor tibi cārus esse.	It seems that I am dear to you.
44	Trāditur Homērus caecus fuisse.	There is a tradition that Homer was blind.
44	Trādunt Homērum caecum fuisse.	There is a tradition that Homer was blind.
45	Cōnstituit Caesar cōnsul fierī.	Caesar determined to become consul.
45	Cōnstituit Caesar ut Antōnius cōnsul fieret.	Caesar determined that Antony should be made consul.
45	Voluit Caesar Antōnium cōnsulem fierī.	Caesar determined that Antony should be made consul.
46	Caesarī nūntiātum est adesse Gallōs.	News was brought to Caesar that the Gauls were at hand.
46	Haec mihi facere vīsum est.	I resolved to do this.
47	Et pater mihi et māter mortuī sunt.	Both my father and mother are dead.
47	Et ego et soror mea ad praetōrem vocātī erāmus.	Both my sister and I had been summoned to the praetor.
48	Fidēs tua et pietās laudandae sunt.	Your good faith and dutifulness are to be praised.
48	Glōria, dīvitiae, honōrēs incerta ac cadūca sunt.	Glory, riches, and distinctions are uncertain and perishable things.
48	Fidēs et pietās laudanda sunt.	Good faith and a sense of duty are to be praised.
48	Spernendae igitur sunt dīvitiae et honōrēs.	Riches then, and distinctions, are to be despised.
48	Mihi prīncipātus atque imperium dēlātum est.	The sovereignty and chief power were offered to me.
49	Terrās omnēs et maria perlūstrāvit.	He travelled over all lands and seas.
50	Bonī sapientēsque ex cīvitāte pelluntur.	The good and wise men are being banished.
50	Iam nostrī aderant.	Our soldiers were now at hand.
50	Omnia mea mēcum portō.	I am carrying all my property with me.
53	Vēra et falsa.	Truth and falsehood
53	Vēra dīcēbat.	He was speaking the truth.
54	Magna spērābat.	His hopes were high.
54	Multa cōgitābat.	He was revolving many thoughts.
54	Illa ausus est.	He ventured on those enterprises.
54	Multa mentītus est.	He told many falsehoods.
54	Haec secūtus est.	This was his object.
54	Quae mentītus est?	What falsehoods has he told?
55	Cicerōnis est amīcus.	He is the friend of Cicero.
55	Cicerōnī est amīcus.	He is friendly to Cicero.
55	Multa fuēre eius et praeclāra facta.	Many and distinguished were his deeds.
55	Multa ab eō praeclārē facta sunt.	Many distinguished things were performed by him.
56	Multae nāvēs longae.	Many ships of war.
58	Rēs aliēnae.	The affairs of others.
58	Condiciō servīlis.	The condition (or state) of slavery.
58	Vir fortis.	A man of courage.
58	Pugna Cannēnsis.	The battle of Cannae.
58	Populus Rōmānus.	The people of Rome.
58	Vir fortissimus.	A man of the greatest courage.
59	Corporis dolor.	Bodily pain.
59	Omnium iūdiciō.	By a unanimous verdict.
59	In hōc omnium lūctū.	In this universal mourning.
59	Meā ūnīus sententiā.	By my single vote.
59	Post hominum memoriam.	Within human memory.
60	Summus mōns.	The top of the mountain
60	In mediam viam.	Into the middle of the road.
60	Reliquum opus.	The rest of the work.
60	Īma vallis.	The bottom of the valley.
60	Novissimum agmen.	The rear of the line of march.
60	Tōta Graecia.	The whole of Greece.
60	Summa temeritās.	The height of rashness.
61	Invītus haec dīcō.	I say this unwillingly.
61	Tacitus haec cōgitābam.	I was meditating silently on these subjects.
61	Imprūdēns hūc vēnī.	I came here unawares.
61	Incolumis rediī.	I returned safely, or in safety.
61	Absēns condemnātus est.	He was condemned in his absence.
61	Tōtus dissentiō.	I disagree wholly.
61	Frequentēs convēnēre.	They came together in crowds.
61	Vīvus.	In his lifetime
61	Mortuus.	After his death
61	Dīversī fūgēre.	They fled in different directions.
62	Prīmus haec fēcit.	He was the first who did this, or to do this.
62	Sōlus mala nostra sēnsit.	He was the only person who perceived our evils.
62	Ultimus vēnisse dīcitur.	It is said that he was the last to come.
63	Hoc puer  didicī.	I learned this lesson in my boyhood.
63	Hoc cōnsul vōvit.	He made this vow in his consulship.
63	Victor rediit.	When victorious he returned.
64	Piē.	With a good conscience.
64	Dīvīnitus.	By a supernatural interposition.
64	Omnīnō.	Speaking in general, as a general rule, etc.
64	Nūllō negōtiō.	Easily.
64	Dubitārī nōn potest quīn	Indisputably.
64	Opportūnē accidit ut...	Fortunately.
64	Fierī potest ut...	Possibly.
64	Errāre tē manifēstum est.	You are obviously mistaken.
64	Aegrōtāre vidēris.	You are apparently unwell.
65	Mulierem aspiciō quae piscēs vēndit.	I see a woman who is selling fish.
65	Ubi est puer cui librum dedistī?	Where is the boy to whom you gave the book?
65	Adsum quī fēcī.	I, who did the deed, am here.
66	Pater eius et māter quī aderant.	His father and mother who were present.
66	Dīvitiae et honōrēs quae cadūca sunt.	Riches and distinctions, which are perishable.
67	Tīmoleōn, id quod difficilius putātur, sapientius tulit secundam quam adversam fortūnam.	Timoleon, though this  is thought the more difficult task, bore prosperity more wisely than adversity.
67	Multae cīvitātēs ā Cyrō dēfēcērunt, quae rēs multōrum bellōrum causa fuit.	Many states revolted from Cyrus; and this was the cause of many wars.
67	Ille, id quod audiistī, Rōmae mortem obiit.	He, as you have heard, died at Rome.
68	Hic est quem vīdī.	This is the man I saw.
68	Librōs quōs voluit repperit.	He found the books he wanted.
69	Volscī cīvitātem, quam habēbant optimam, perdidērunt.	The Volsci lost the best city they had.
69	Equitēs, quōs paucōs sēcum habuit, dīmīsit.	He sent away the few mounted men whom he had with him.
69	Quā erat animī benignitāte, omnibus veniam dedit.	Such was his kindliness, he pardoned all.
70	Is sum quī semper fuī.	I am the man I always was.
71	Quī haec vidēbant, flēbant.	Those who saw this wept.
71	Eīs, quī adstābant, īrāscēbātur.	He was angry with those who stood by.
72	Eum quī haec facit ōdī.	I hate a man who does this.
72	Eōs quī haec faciunt ōdī.	I hate men who do this.
72	Quī haec faciunt, peiōra facient.	Men who are doing this will do worse.
73	Adstantium clāmōre perterritus.	Alarmed by the shouts of the bystanders.
73	Interrogantibus respondit.	He replied to those who questioned him.
75	Quī tum tē dēfendit, is hodiē accūsat.	The very man who then defended you is today accusing you.
76	Quī mē cēpērunt.	My captors.
76	Quī mē vīcit.	My conqueror.
76	Ea quae vēra sunt.	The truth.
77	Est flūmen quod appellātur Tamesis.	There is a river which is called the Thames.
77	Mulierem aspiciō quae piscēs vēndit.	I see a woman who is selling fish.
77	Ait sē mulierem aspicere quae piscēs vēndat.	He says that he sees a woman who is selling fish.
78	Ad rēgem vēnī, quem cum vīdissem...	I came to the king, and when I had seen him...
79	Dīxit prōditōrem esse eum ... quem brevī peritūrum esse.	He said that he was a traitor ... and that he would soon perish.
80	Nēmō est quīn tē dēmentem putet.	There is no one but thinks you mad (i.e. the whole world thinks, etc.)
80	Nēmō fuit quīn vīderim.	There was no one whom I did not see.
81	Prīmus haec fēcit.	He was the first who did this.
82	Agricolam laudat iūris lēgumque perītus.	It is the farmer whom the lawyer praises.
83	Thēbae, quod Boeōtiae caput est.	Thebes, which is the capital of Boeotia.
83	Ea vēra est pietās.	That is true piety.
84	Tālis est quālis semper fuit.	He is of the same character as he has ever been.
84	Tantam habeō voluptātem quantam tū.	I have as much pleasure as you.
84	Tot erant mīlitēs quot maris flūctūs.	The soldiers were as many as the waves of the sea.
84	Īdem est quī semper fuit.	He is the same as he has always been.
84	Rēs perācta est eōdem modō quō anteā.	The thing has been done in the same manner as before.
85	Quot adstābant hominēs, tot erant sententiae.	There were as many opinions as there were men standing by.
85	Quālis fuit domina, tālem ancillam inveniēs.	You will find the maid of the same character as her mistress was.
87	Huius modī hominēs ōdī.	I hate such men as these.
88	Haec tanta multitūdō.	This great number of men.
88	Hic tam bonus vir.	So good a man as this.
89	Inde vēnistī, unde ego.	You have come from the same place as I.
89	Eō rediit, unde profectus est.	He returned to the place from which he had set out.
90	Eadem ac tū sentiō.	My views are the same as yours.
91	Rēs aliter quam exspectāvī ēvēnit.	The matter turned out contrary to my expectation.
93	Ubi tū es, ibi est frāter tuus.	Your brother is in the same place as you.
93	Quālis fuerit frāter tuus, tālem tē esse dīcunt.	They say that you are of the same character as your brother was.
94	Sedēre mē dēlectat.	Sitting delights me.
95	Nihil agere mē dēlectat.	Doing nothing is a pleasure to me.
95	Turpe est mentīrī.	Lying is disgraceful.
95	Homō cui vīvere est cōgitāre.	Man, to whom living is thinking.
95	Errāre, nescīre, et malum et turpe dūcimus.	To err, to be ignorant, we deem both unfortunate and disgraceful.
95	Laudārī, quod plērīsque grātissimum est, mihi molestissimum est.	To be praised, which is very pleasant to most men, is to me most disagreeable.
96	Bene arāre est bene colere.	Good ploughing is good farming.
96	Haec perpetī et patriā carēre, miserrimum est.	To endure these things and to be deprived of one’s country, is most wretched.
96	Haec facere (fēcisse, factūrum esse).	The doing (the having done, the being about to do) this.
96	Tē hoc dīcere mihi est grātissimum.	Your saying this is most welcome to me.
101	Multī aliōs laudant, ut ab illīs laudentur.	Many men praise others, that they may be praised by them.
101	Multī aliōs laudābant, ut ab illīs laudārentur.	Many men were praising others, in order to be praised by them.
101	Gallīnae avēsque reliquae pennīs fovent pullōs, nē frīgore laedantur.	Hens and other birds cherish their young with their feathers, that they may not be hurt by the cold.
101	Gallīnae avēsque reliquae pennīs fovēbant pullōs, nē frīgore laederentur.	Hens and other birds were cherishing their young with their feathers, that they might not be hurt by the cold.
102	Medicō puto aliquid dandum esse, quō sit studiōsior.	I think that something should be given to the physician, that he may be the more attentive.
103	Hoc fēcī nē tibi displicērem nēve amīcīs tuīs nocērem.	I did this to avoid displeasing you, or injuring your friends.
105	Haec scrībō (scrīpsī, scrībam, scrīpserō) ut bonō sīs animō.	I write (have written, shall write, shall have written) this, in order that you may be in good spirits.
105	Haec scrībēbam (scrīpsī, scrīpseram) ut bonō essēs animō.	I was writing (wrote, had written) this, in order that you might be in good spirits.
105	Dīcō eum vēnisse ut pācem peteret.	I say he came to seek peace.
107	Nēmō tam potēns est ut omnia efficere possit.	Nobody is so powerful as to be able to perform everything.
107	Tanta vīs probitātis est ut eam vel in hoste dīligāmus.	Such is the force of honesty that we love it even in an enemy.
108	Puer humī prōlāpsus est ut crūs frangeret.	The boy fell down so as to break his leg.
108	Hoc eō cōnsiliō dīxī ut tibi prōdessem.	I said this to be of use to you (Final Clause).
108	Hoc ita dīxī ut tibi prōdessem.	I said this to be of use to you (Consecutive Clause).
108	Ut multitūdō solet, concurrunt.	They are running together, as a multitude is wont to do.
108	Tālis fuit ut nēmō eī crēderet.	He was of such a character that no one believed him.
108	Tālis fuit quālem nēmō anteā viderat.	He was of such a character as no one had seen before.
109	Tanta fuit virī moderātiō ut repugnantī mihi nōn īrāscerētur.	The self-control of the man was so great, that he was not angry with me when I opposed him.
109	Portae clausae sunt nē quis urbem relinqueret.	The gates were shut that no one might leave the city.
109	Tantus fuit omnium metus ut nēmō urbem relīquerit.	The fear of all men was so great that no one left the city.
111	Ita bonus est ut interdum peccet.	He is good to this extent, that he makes mistakes sometimes.
111	Nec perīre potes ut nōn aliōs perdās.	Nor can you be ruined without ruining others.
112	Hoc eum adeō terruit ut vix hodiē prōdīre audeat.	This so terrified him that he scarcely ventures to come forward today.
112	Verrēs Siciliam ita perdidit ut ea restituī nōn possit.	Verres so ruined Sicily that it cannot now be restored.
113	Tanta fuit pestis ut rēx ipse morbō absūmptus sit.	The pestilence was so great that the King himself was cut off by the disease.
114	Adeō territī sumus ut numquam posthāc pugnātūrī sīmus.	We were so frightened that we shall never fight again.
114	Dīxit sē adeō territōs esse ut numquam posteā pugnātūrī essent.	He said that they had been so frightened that they would never fight again.
115	Tanta fuit caedēs ut ... nēmō superfutūrus fuerit.	The slaughter was such that no one would have survived.
116	Hoc ita faciō (fēcī, faciam) ut tibi displiceam.	I do (am doing, have done, will do) this in such a way as to displease you.
116	Hoc ita fēcī (faciēbam, fēceram) ut tibi displicērem	I did (was doing, had done) this in such a way as to displease you.
116	Hoc ita fēcī ut tibi displiceam.	I did this in such a way as to be displeasing to you now.
116	Hoc ita fēcī ut tibi displicuerim.	I did this in such a way so that, as a matter of fact, I displeased you.
116	Dīxit sē hoc ita fēcisse ut tibi displicēret.	He said that he did this in such a way as to displease you.
116	Hoc ita fēcī ut tibi displicitūrus sim.	I have done this in such a way that I shall displease you.
117	Tē rogō atque ōrō ut eum iuvēs.	I ask and beg you to help him.
118	Mihi nē quid facerem imperāvit.	He ordered me to do nothing.
118	Hoc tē rogō, nē dēmittās animum.	I beg of you not to be disheartened.
118	Magnō opere tē hortor ut hōs librōs studiōsē legās.	I earnestly advise you to read these books attentively.
118	Helvētiīs persuāsit ut exīrent.	He persuaded the Helvetii to depart.
118	Cōnsulī permissum est ut duās legiōnēs scrīberet.	The consul was permitted to enroll two legions.
120	Cōnsul mīlitēs pedem referre iussit.	The consul ordered the soldiers to retreat.
121	Culpam fateāre necesse est.	You must needs avow your fault.
121	Hoc faciās velim.	I would have you do this.
124	Moneō adesse hostem.	I warn you that the enemy is at hand.
124	Nē hoc faciās moneō.	I warn you not to do this.
124	Mihi persuāsum est fīnem adesse.	I was persuaded that the end was near.
124	Mihi persuāsum est nē hoc facerem.	I was persuaded not to do this.
124	Mihi scrīpsit sē ventūrum esse.	He wrote me word that he would come.
124	Mihi scrīpsit nē ad sē venīrem.	He wrote to me to beg me not to come to him.
125	Effēcit nē ex urbe exīrent.	He prevented their leaving the city.
125	Effēcit nē poenās daret.	He contrived not to be punished.
126	Accidit ut nēmō senātor adesset.	It happened that no senator was present
126	Ex quō factum est ut bellum indīcerētur.	The consequence of this was that war was declared.
127	Cāsū accidit.	It happens by chance.
127	Ēvenit.	It happens.
127	Ita fit.	Thus it happens.
127	Quī fit?	How happens it? How is it?
127	Fierī potest.	It can happen. It is possible. Possibly.
127	Nūllō modō fierī potest.	It is quite impossible.
127	Sequitur, proximum est.	It follows. The next thing is.
127	Reliquum est, restat.	It remains.
128	Tantum abest ut nostra mīrēmur, ut nōbīs nōn satisfaciat ipse Dēmosthenēs.	So far are we from admiring our own works, that Demosthenes himself does not satisfy us.
129	Atticus, nē qua sibi statua pōnerētur, restitit.	Atticus opposed having any statue raised to himself.
129	Nāvēs ventō tenēbantur quōminus in portum redīrent.	The ships were prevented by the wind from returning into harbour.
130	Caesar mīlitēs pedem referre vetuit.	Caesar forbade his soldiers to retreat.
130	Nōn recūsō abīre.	I do not object to going.
131	Plūra nē dīcam impedior.	I am prevented from saying more.
131	Per tē stetit quōminus vincerēmus.	You were the cause of our not winning the day.
131	Nōn recūsābō quōminus tē in vincula dūcam.	I will not object to taking you to prison.
131	Germānī retinērī nōn poterant quīn tēla conicerent.	The Germans could not be restrained from hurling their weapons.
132	Vix inhibērī potuit quīn saxa iaceret.	He could scarcely be prevented from throwing stones.
132	Num quis obstat quīn vēra dīcas?	Does anyone prevent your telling the truth?
133	Quīn tū tacēs?	Why do you not keep silent?
133	Quīn Deciōs aspice.	Look at the Decii.
134	Nihil tam difficile est quīn investīgārī possit.	Nothing is so difficult that it cannot be discovered.
134	Nec multum āfuit quīn interficerēmur.	And we were not far from losing our lives.
134	Nūllō modō fierī potest quīn errem.	It is quite impossible that I am not mistaken, or but that I am, etc.
134	Facere vix potuī quīn tē accūsārem.	It was scarcely possible for me not to accuse you.
134	Nec eum umquam adspexit, quīn frātricīdam compellāret.	And she never beheld him without calling him a fratricide.
135	Nōn dubium erat quīn plūrimum Helvētiī possent.	There was no doubt that the Helvetii were the most powerful.
135	Quis dubitat quīn hoc fēcerīs?	Who doubts but that you did this?
136	Dubitō num veniat.	I am uncertain whether he is coming.
137	Vereor nē veniat.	I fear that he will come.
137	Vereor ut veniat.	I fear that he will not come.
137	Meritus sum ut venīret.	I feared that he would not come.
137	Perīculum erat nē hostēs urbem expugnārent	There was a danger of the enemy’s taking the city.
137	Vereor nē exercitum firmum habēre nōn possit.	I fear he cannot have a strong army.
138	Vereor ut hoc tibi prōfutūrum sit.	I am afraid that this is not going to do you good.
139	Caesar timēbat flūminī exercitum obicere.	Caesar was unwilling to expose his army to the river.
140	Ad mē venī.	Come to me.
140	Audīte hoc.	Hear this.
142	Postrēmus loquāris, prīmus taceās.	Be you the last to speak, the first to be silent.
143	Nōlī hoc facere.	Do not do this.
143	Cavē nē hoc faciās.	Do not do this.
143	Nē dubitāverīs.	Do not hesitate.
143	Nē multa discās, sed multum.	Do not learn many things, but learn deeply.
144	Nē veniat.	Let him not come.
145	Exeat nēve plūra dīcat.	Let him go out and say no more.
145	Hoc facitō; illud nē fēcerīs, nēve dīxerīs.	Do this; do not do or say that.
146	Dē hāc rē tū vīderis.	I leave this to you.
146	Vīderint sapientiōrēs.	Let wiser men, decide.
147	Istam nē relīquerīs!	Do not leave her!
147	Dī prohibeant.	May the gods forbid.
147	Sī veniās, videās.	If you should come, you would see.
149	Abeat.	Let him go away.
149	Amēmus patriam.	Let us love our country.
